{
  "source_type": "code4rena-report-low-non-critical",
  "source_name": "Code4rena Kinetiq Findings and Analysis Report (2025-04) - Low Risk and Non-Critical Issues",
  "source_url": "https://code4rena.com/reports/2025-04-kinetiq#low-risk-and-non-critical-issues",
  "source_report_section": "Low Risk and Non-Critical Issues",
  "protocol_name": "Kinetiq",
  "project_repo": "https://github.com/code-423n4/2025-04-kinetiq",
  "language": "solidity",
  "retrieval_channel": "low_non_critical_caution",
  "id": "c4-2025-04-kinetiq-low-04",
  "component_types": [
    "oracle-manager"
  ],
  "issue_title": "Handling of Zero Timestamps",
  "classification": "low",
  "summary": "The function does not explicitly validate or handle cases where an oracle returns a zero timestamp, which could indicate invalid or stale data, potentially affecting performance calculations.",
  "root_cause": "QA/low-risk implementation weakness described in the final C4 low/non-critical report.",
  "why_not_medium_or_high": "the issue is presented in the final report low/non-critical section and does not by itself establish a permissionless high-impact exploit or direct loss of principal assets",
  "operational_risk": "The function does not explicitly validate or handle cases where an oracle returns a zero timestamp, which could indicate invalid or stale data, potentially affecting performance calculations.",
  "affected_functions": [
    "OracleManager.sol",
    "generatePerformance"
  ],
  "recommended_mitigation": [
    "Add a check to skip or flag zero timestamps: event InvalidTimestamp(address indexed oracle, uint256 timestamp); if (oracleData.timestamp == 0) { emit InvalidTimestamp(oracle.address, 0); continue; }"
  ],
  "when_it_could_escalate": [
    "if combined with permissionless access, stale oracle data, or large unbounded sets",
    "if protocol configuration makes this path critical to solvency or withdrawal availability"
  ],
  "tags": [
    "kinetiq",
    "oracle",
    "event-emission",
    "low"
  ]
}
