{
  "source_type": "code4rena-report-low-non-critical",
  "source_name": "Code4rena Kinetiq Findings and Analysis Report (2025-04) - Low Risk and Non-Critical Issues",
  "source_url": "https://code4rena.com/reports/2025-04-kinetiq#low-risk-and-non-critical-issues",
  "source_report_section": "Low Risk and Non-Critical Issues",
  "protocol_name": "Kinetiq",
  "project_repo": "https://github.com/code-423n4/2025-04-kinetiq",
  "language": "solidity",
  "retrieval_channel": "low_non_critical_caution",
  "id": "c4-2025-04-kinetiq-low-11",
  "component_types": [
    "oracle-manager"
  ],
  "issue_title": "Immutable defaultOracle Creates Single Point of Failure",
  "classification": "low",
  "summary": "The immutable defaultOracle address cannot be updated, creating a single point of failure if the oracle becomes compromised or unreliable.",
  "root_cause": "QA/low-risk implementation weakness described in the final C4 low/non-critical report.",
  "why_not_medium_or_high": "the issue is presented in the final report low/non-critical section and does not by itself establish a permissionless high-impact exploit or direct loss of principal assets",
  "operational_risk": "The immutable defaultOracle address cannot be updated, creating a single point of failure if the oracle becomes compromised or unreliable.",
  "affected_functions": [
    "DefaultAdapter.sol"
  ],
  "recommended_mitigation": [
    "Use a mutable variable with access control: address public defaultOracle; function setOracle(address newOracle) external onlyOwner { require(newOracle != address(0), \"Invalid oracle\"); defaultOracle = newOracle; }"
  ],
  "when_it_could_escalate": [
    "if combined with permissionless access, stale oracle data, or large unbounded sets",
    "if protocol configuration makes this path critical to solvency or withdrawal availability"
  ],
  "tags": [
    "kinetiq",
    "oracle",
    "access-control",
    "low"
  ]
}
