{
  "source_type": "code4rena-report-low-non-critical",
  "source_name": "Code4rena Kinetiq Findings and Analysis Report (2025-04) - Low Risk and Non-Critical Issues",
  "source_url": "https://code4rena.com/reports/2025-04-kinetiq#low-risk-and-non-critical-issues",
  "source_report_section": "Low Risk and Non-Critical Issues",
  "protocol_name": "Kinetiq",
  "project_repo": "https://github.com/code-423n4/2025-04-kinetiq",
  "language": "solidity",
  "retrieval_channel": "low_non_critical_caution",
  "id": "c4-2025-04-kinetiq-low-14",
  "component_types": [
    "staking-manager",
    "withdrawal-flow"
  ],
  "issue_title": "Lack of Rate Limiting on Withdrawal Queueing",
  "classification": "low",
  "summary": "Users can spam queueWithdrawal, bloating the _withdrawalRequests mapping and degrading performance.",
  "root_cause": "QA/low-risk implementation weakness described in the final C4 low/non-critical report.",
  "why_not_medium_or_high": "the issue is presented in the final report low/non-critical section and does not by itself establish a permissionless high-impact exploit or direct loss of principal assets",
  "operational_risk": "Users can spam queueWithdrawal, bloating the _withdrawalRequests mapping and degrading performance.",
  "affected_functions": [
    "StakingManager.sol",
    "queueWithdrawal"
  ],
  "recommended_mitigation": [
    "Add rate limiting: require(lastWithdrawal[msg.sender] + 1 hours < block.timestamp, \"Too soon\");"
  ],
  "when_it_could_escalate": [
    "if combined with permissionless access, stale oracle data, or large unbounded sets",
    "if protocol configuration makes this path critical to solvency or withdrawal availability"
  ],
  "tags": [
    "kinetiq",
    "staking",
    "withdrawal",
    "queue-processing",
    "low"
  ]
}
