{
  "source_type": "code4rena-report-low-non-critical",
  "source_name": "Code4rena Nudge.xyz Findings and Analysis Report (2025-03) - Low Risk and Non-Critical Issues",
  "source_url": "https://code4rena.com/reports/2025-03-nudgexyz#low-risk-and-non-critical-issues",
  "source_report_section": "Low Risk and Non-Critical Issues",
  "protocol_name": "Nudge.xyz",
  "project_repo": "https://github.com/code-423n4/2025-03-nudgexyz",
  "language": "solidity",
  "retrieval_channel": "low_non_critical_caution",
  "id": "c4-2025-03-nudgexyz-low-05",
  "component_types": [
    "campaign-factory",
    "reward-accounting",
    "economic-parameter-validation"
  ],
  "issue_title": "Missing rewardPPQ validation in campaign deployment functions",
  "classification": "low",
  "summary": "NudgeCampaignFactory.deployCampaign and deployAndFundCampaign do not validate rewardPPQ. A zero rewardPPQ creates campaigns that distribute no rewards, while rewardPPQ greater than or equal to PPQ_DENOMINATOR can define very high or unsustainable reward rates.",
  "root_cause": "missing bounds checks for a core economic reward-rate parameter",
  "why_not_medium_or_high": "the issue is primarily bad campaign configuration; without an untrusted setter or concrete drain path, it remains a low/QA economic-parameter risk",
  "operational_risk": "campaigns can be economically nonsensical, misleading to participants, or unsustainable for campaign administrators",
  "affected_functions": [
    "NudgeCampaignFactory.deployCampaign",
    "NudgeCampaignFactory.deployAndFundCampaign"
  ],
  "recommended_mitigation": [
    "require rewardPPQ > 0",
    "require rewardPPQ < PPQ_DENOMINATOR or another protocol-defined maximum",
    "document acceptable reward-rate bounds"
  ],
  "when_it_could_escalate": [
    "if untrusted users can create funded campaigns with unsafe reward rates",
    "if excessive rewardPPQ enables rapid reward exhaustion under normal participation",
    "if frontends do not surface reward-rate anomalies"
  ],
  "tags": [
    "low",
    "reward-ppq",
    "economic-parameter",
    "input-validation",
    "campaign-factory",
    "reward-accounting"
  ]
}
