{
  "source_type": "code4rena-report-low-non-critical",
  "source_name": "Code4rena Kinetiq Findings and Analysis Report (2025-04) - Low Risk and Non-Critical Issues",
  "source_url": "https://code4rena.com/reports/2025-04-kinetiq#low-risk-and-non-critical-issues",
  "source_report_section": "Low Risk and Non-Critical Issues",
  "protocol_name": "Kinetiq",
  "project_repo": "https://github.com/code-423n4/2025-04-kinetiq",
  "language": "solidity",
  "retrieval_channel": "low_non_critical_caution",
  "id": "c4-2025-04-kinetiq-low-16",
  "component_types": [
    "staking-manager",
    "validator-management",
    "withdrawal-flow"
  ],
  "issue_title": "Silent Precision Loss in Decimal Conversion",
  "classification": "low",
  "summary": "Converting amounts from 18 to 8 decimals can result in zero values for small amounts, leading to discrepancies between internal accounting and validator state.",
  "root_cause": "QA/low-risk implementation weakness described in the final C4 low/non-critical report.",
  "why_not_medium_or_high": "the issue is presented in the final report low/non-critical section and does not by itself establish a permissionless high-impact exploit or direct loss of principal assets",
  "operational_risk": "Converting amounts from 18 to 8 decimals can result in zero values for small amounts, leading to discrepancies between internal accounting and validator state.",
  "affected_functions": [
    "StakingManager.sol",
    "_withdrawFromValidator"
  ],
  "recommended_mitigation": [
    "Add a check to ensure the truncated amount is greater than zero: require(truncatedAmount > 0, \"Truncated withdrawal amount is zero\");"
  ],
  "when_it_could_escalate": [
    "if combined with permissionless access, stale oracle data, or large unbounded sets",
    "if protocol configuration makes this path critical to solvency or withdrawal availability"
  ],
  "tags": [
    "kinetiq",
    "staking",
    "withdrawal",
    "precision-loss",
    "validator-management",
    "low"
  ]
}
