{
  "source_type": "code4rena-report-low-non-critical",
  "source_name": "Code4rena Kinetiq Findings and Analysis Report (2025-04) - Low Risk and Non-Critical Issues",
  "source_url": "https://code4rena.com/reports/2025-04-kinetiq#low-risk-and-non-critical-issues",
  "source_report_section": "Low Risk and Non-Critical Issues",
  "protocol_name": "Kinetiq",
  "project_repo": "https://github.com/code-423n4/2025-04-kinetiq",
  "language": "solidity",
  "retrieval_channel": "low_non_critical_caution",
  "id": "c4-2025-04-kinetiq-low-01",
  "component_types": [
    "khype-token"
  ],
  "issue_title": "Missing whenNotPaused Modifier in mint Function",
  "classification": "low",
  "summary": "The mint function does not include the whenNotPaused modifier, despite being called by functions that enforce this restriction. This omission allows minting operations to proceed when the contract is paused, potentially leading to unauthorized token issuance or state inconsistencies during a pause intended to halt operations.",
  "root_cause": "QA/low-risk implementation weakness described in the final C4 low/non-critical report.",
  "why_not_medium_or_high": "the issue is presented in the final report low/non-critical section and does not by itself establish a permissionless high-impact exploit or direct loss of principal assets",
  "operational_risk": "The mint function does not include the whenNotPaused modifier, despite being called by functions that enforce this restriction. This omission allows minting operations to proceed when the contract is paused, potentially leading to unauthorized token issuance or state inconsistencies during a pause intended to halt operations.",
  "affected_functions": [
    "KHYPE.sol",
    "mint"
  ],
  "recommended_mitigation": [
    "Add the whenNotPaused modifier to the mint function to ensure it cannot be executed while the contract is paused: function mint(...) public whenNotPaused { // ... existing logic ... }"
  ],
  "when_it_could_escalate": [
    "if combined with permissionless access, stale oracle data, or large unbounded sets",
    "if protocol configuration makes this path critical to solvency or withdrawal availability"
  ],
  "tags": [
    "kinetiq",
    "pause-control",
    "minting",
    "low"
  ]
}
