{
  "source_type": "code4rena-report-low-non-critical",
  "source_name": "Code4rena Ethena Findings and Analysis Report (2023-10) - Low Risk and Non-Critical Issues",
  "source_url": "https://code4rena.com/reports/2023-10-ethena",
  "source_report_section": "Low Risk and Non-Critical Issues / QA",
  "protocol_name": "Ethena",
  "project_repo": "https://github.com/code-423n4/2023-10-ethena",
  "language": "solidity",
  "retrieval_channel": "low_non_critical_caution",
  "id": "c4-2023-10-ethena-low-07",
  "component_types": [
    "redemption-flow",
    "cooldown-flow",
    "usde-token"
  ],
  "issue_title": "Typo mistakes",
  "classification": "low",
  "summary": "- /// @param owner address to redeem and start cooldown, owner must allowed caller to perform this action + /// @param owner address to redeem and start cooldown, owner must allow caller to perform this action",
  "root_cause": "QA/low-risk implementation weakness described in the final C4 low/non-critical report.",
  "why_not_medium_or_high": "the issue appears in the final report low/non-critical or QA section and does not by itself prove a permissionless high-impact exploit",
  "operational_risk": "- /// @param owner address to redeem and start cooldown, owner must allowed caller to perform this action + /// @param owner address to redeem and start cooldown, owner must allow caller to perform this action",
  "affected_functions": [],
  "recommended_mitigation": [],
  "when_it_could_escalate": [
    "if combined with permissionless access or large-value state transitions",
    "if the affected path becomes critical to mint/redeem/withdrawal solvency or availability"
  ],
  "tags": [
    "staking",
    "redemption",
    "cooldown",
    "usde",
    "ethena",
    "low"
  ]
}
