{
  "source_type": "code4rena-report-low-non-critical",
  "source_name": "Code4rena Nudge.xyz Findings and Analysis Report (2025-03) - Low Risk and Non-Critical Issues",
  "source_url": "https://code4rena.com/reports/2025-03-nudgexyz#low-risk-and-non-critical-issues",
  "source_report_section": "Low Risk and Non-Critical Issues",
  "protocol_name": "Nudge.xyz",
  "project_repo": "https://github.com/code-423n4/2025-03-nudgexyz",
  "language": "solidity",
  "retrieval_channel": "low_non_critical_caution",
  "id": "c4-2025-03-nudgexyz-low-03",
  "component_types": [
    "campaign-factory",
    "off-chain-indexing",
    "identifier-management"
  ],
  "issue_title": "Missing UUID uniqueness validation in campaign deployment",
  "classification": "low",
  "summary": "NudgeCampaignFactory does not enforce uniqueness of campaign UUIDs in deployCampaign or deployAndFundCampaign. CREATE2 may still produce unique addresses because other salt inputs differ, but duplicated UUIDs can confuse off-chain tracking, analytics, or integrations that rely on UUID as a unique identifier.",
  "root_cause": "missing uniqueness tracking for externally meaningful campaign identifiers",
  "why_not_medium_or_high": "duplicated UUIDs primarily affect off-chain consistency and integration correctness; no direct on-chain exploit or asset loss is demonstrated",
  "operational_risk": "off-chain systems may merge or misattribute campaigns, producing tracking, analytics, or integration errors",
  "affected_functions": [
    "NudgeCampaignFactory.deployCampaign",
    "NudgeCampaignFactory.deployAndFundCampaign"
  ],
  "recommended_mitigation": [
    "track used UUIDs in a mapping",
    "reject campaign deployments with a previously used UUID",
    "emit or expose canonical campaign-id mappings for off-chain systems"
  ],
  "when_it_could_escalate": [
    "if UUIDs are used for authorization, reward attribution, or settlement outside the contract",
    "if integrators treat UUID as a unique primary key",
    "if campaign creation is delegated to untrusted parties"
  ],
  "tags": [
    "low",
    "uuid",
    "off-chain-indexing",
    "campaign-factory",
    "identifier-uniqueness"
  ]
}
