{
  "source_type": "code4rena-report-low-non-critical",
  "source_name": "Code4rena Kinetiq Findings and Analysis Report (2025-04) - Low Risk and Non-Critical Issues",
  "source_url": "https://code4rena.com/reports/2025-04-kinetiq#low-risk-and-non-critical-issues",
  "source_report_section": "Low Risk and Non-Critical Issues",
  "protocol_name": "Kinetiq",
  "project_repo": "https://github.com/code-423n4/2025-04-kinetiq",
  "language": "solidity",
  "retrieval_channel": "low_non_critical_caution",
  "id": "c4-2025-04-kinetiq-low-08",
  "component_types": [
    "pauser-registry"
  ],
  "issue_title": "Inefficient Event Emission in emergencyPauseAll",
  "classification": "low",
  "summary": "Emitting a ContractPaused event for each contract in a loop increases gas costs, especially with many contracts, impacting efficiency.",
  "root_cause": "QA/low-risk implementation weakness described in the final C4 low/non-critical report.",
  "why_not_medium_or_high": "the issue is presented in the final report low/non-critical section and does not by itself establish a permissionless high-impact exploit or direct loss of principal assets",
  "operational_risk": "Emitting a ContractPaused event for each contract in a loop increases gas costs, especially with many contracts, impacting efficiency.",
  "affected_functions": [
    "PauserRegistery.sol",
    "emergencyPauseAll"
  ],
  "recommended_mitigation": [
    "Emit a single event listing all paused contracts: event ContractsPaused(address[] contracts); function emergencyPauseAll() { address[] memory pausedContracts = new address[](contracts.length); for (uint256 i = 0; i < contracts.length; i++) { pausedContracts[i] = contracts[i]; // ... pause logic ... } emit ContractsPaused(pausedContracts); }"
  ],
  "when_it_could_escalate": [
    "if combined with permissionless access, stale oracle data, or large unbounded sets",
    "if protocol configuration makes this path critical to solvency or withdrawal availability"
  ],
  "tags": [
    "kinetiq",
    "pause-control",
    "gas-dos",
    "event-emission",
    "low"
  ]
}
